{
  "ModelIdentityAndFocus": {
    "Features": [
      {
        "FeatureName": "Model Identity",
        "FeatureAttributes": [
          {
            "FeatureAttributeName": "ES Model Identity",
            "Instances": [
              {
                "InstanceName": "Base Instance",
                "AccessControl": "",
                "Identifier": "",
                "Description": "",
                "DefiningActivity": "",
                "InstanceAttributes": {}
              }
            ]
          }
        ]
      },
      {
        "FeatureName": "Model Purpose",
        "FeatureAttributes": [
          {
            "FeatureAttributeName": "ES Model Purpose",
            "Instances": [
              {
                "InstanceName": "Base Instance",
                "AccessControl": "",
                "Identifier": "",
                "Description": "",
                "DefiningActivity": "",
                "InstanceAttributes": {
                  "PurposeType": []
                }
              }
            ]
          }
        ]
      },
      {
        "FeatureName": "Modeled System of Interest",
        "FeatureAttributes": [
          {
            "FeatureAttributeName": "System of Interest",
            "Instances": [
              {
                "InstanceName": "",
                "AccessControl": "",
                "Identifier": "",
                "Description": "",
                "DefiningActivity": "",
                "InstanceAttributes": {}
              }
            ]
          }
        ]
      },
      {
        "FeatureName": "Modeled Environmental Domains",
        "FeatureAttributes": [
          {
            "FeatureAttributeName": "Modeled Domains",
            "Instances": [
              {
                "InstanceName": "",
                "AccessControl": "",
                "Identifier": "",
                "Description": "",
                "DefiningActivity": "",
                "InstanceAttributes": {
                  "Type": "",
                  "Classification": ""
                }
              }
            ]
          }
        ]
      },
      {
        "FeatureName": "Modeled Scenario",
        "FeatureAttributes": [
          {
            "FeatureAttributeName": "Modeled Scenarios",
            "Instances": [
              {
                "InstanceName": "",
                "AccessControl": "",
                "Identifier": "",
                "Description": "",
                "DefiningActivity": "",
                "InstanceAttributes": {
                  "ModelObjectives": []
                }
              }
            ]
          }
        ]
      }
    ]
  },

  "ModelScopeOfContent": {
    "Features": [
      {
        "FeatureName": "Modeled Stakeholder Value",
        "FeatureAttributes": [
          {
            "FeatureAttributeName": "Stakeholder Values of Interest",
            "Instances": [
              {
                "InstanceName": "",
                "AccessControl": "",
                "Identifier": "",
                "Description": "",
                "DefiningActivity": "",
                "InstanceAttributes": {
                  "StakeholderGroupsImpacted": [],
                  "CoupledExternalInteractions": "",
                  "CoupledInternalInteractions": "",
                  "CoupledQuantitiesOfInterest": ""
                }
              }
            ]
          }
        ]
      },
      {
        "FeatureName": "Modeled System External Behavior",
        "FeatureAttributes": [
          {
            "FeatureAttributeName": "External Interactions",
            "Instances": [
              {
                "InstanceName": "",
                "AccessControl": "",
                "Identifier": "",
                "Description": "",
                "DefiningActivity": "",
                "InstanceAttributes": {
                  "InputOutputExchange": "",
                  "ExternalInterface": ""
                }
              }
            ]
          }
        ]
      },
      {
        "FeatureName": "Modeled System Internal Behavior",
        "FeatureAttributes": [
          {
            "FeatureAttributeName": "Internal Interactions",
            "Instances": [
              {
                "InstanceName": "",
                "AccessControl": "",
                "Identifier": "",
                "Description": "",
                "DefiningActivity": "",
                "InstanceAttributes": {
                  "QuantitiesOfInterest": "",
                  "Relationships": ""
                }
              }
            ]
          }
        ]
      },
      {
        "FeatureName": "Model Attributes",
        "FeatureAttributes": [
          {
            "FeatureAttributeName": "Model Components & Relationships",
            "Instances": [
              {
                "InstanceName": "",
                "AccessControl": "",
                "Identifier": "",
                "Description": "",
                "DefiningActivity": "",
                "InstanceAttributes": {
                  "ArchitecturalRelationship": "",
                  "OtherRelationships": "",
                  "CorrelationToSystemComponents": ""
                }
              }
            ]
          }
        ]
      },
      {
        "FeatureName": "Conceptual Model Behavior Couplings",
        "FeatureAttributes": [
          {
            "FeatureAttributeName": "I/O Couplings",
            "Instances": [
              {
                "InstanceName": "",
                "AccessControl": "",
                "Identifier": "",
                "Description": "",
                "DefiningActivity": "",
                "InstanceAttributes": {
                  "Inputs": "",
                  "Outputs": ""
                }
              }
            ]
          },
          {
            "FeatureAttributeName": "Decomposition Couplings",
            "Instances": [
              {
                "InstanceName": "",
                "AccessControl": "",
                "Identifier": "",
                "Description": "",
                "DefiningActivity": "",
                "InstanceAttributes": {
                  "BehaviorCouplings": "",
                  "OtherCouplings": ""
                }
              }
            ]
          },
          {
            "FeatureAttributeName": "Characterization Couplings",
            "Instances": [
              {
                "InstanceName": "",
                "AccessControl": "",
                "Identifier": "",
                "Description": "",
                "DefiningActivity": "",
                "InstanceAttributes": {
                  "FunctionalIdentityType": "",
                  "ObjectiveBehavior": ""
                }
              }
            ]
          }
        ]
      },
      {
        "FeatureName": "Managed Model Datasets",
        "FeatureAttributes": [
          {
            "FeatureAttributeName": "Datasets",
            "Instances": [
              {
                "InstanceName": "",
                "AccessControl": "",
                "Identifier": "",
                "Description": "",
                "DefiningActivity": "",
                "InstanceAttributes": {
                  "DatasetType": "",
                  "OtherDatasetAttributes": ""
                }
              }
            ]
          }
        ]
      },
      {
        "FeatureName": "Failure Modes and Effects",
        "FeatureAttributes": [
          {
            "FeatureAttributeName": "Identified Potential Failure Modes",
            "Instances": [
              {
                "InstanceName": "",
                "AccessControl": "",
                "Identifier": "",
                "Description": "",
                "DefiningActivity": "",
                "InstanceAttributes": {
                  "FailureModeDescription": "",
                  "FailureCause": "",
                  "FailureEffect": "",
                  "Likelihood": ""
                }
              }
            ]
          }
        ]
      }
    ]
  },

  "ModelRepresentation": {
    "Features": [
      {
        "FeatureName": "Model Form",
        "FeatureAttributes": [
          {
            "FeatureAttributeName": "Model Form Type",
            "Instances": [
              {
                "InstanceName": "",
                "AccessControl": "",
                "Identifier": "",
                "Description": "",
                "DefiningActivity": "",
                "InstanceAttributes": {
                  "ModelFormType": "",
                  "ModelFormClassification": ""
                }
              }
            ]
          }
        ]
      },
      {
        "FeatureName": "Model Structure",
        "FeatureAttributes": [
          {
            "FeatureAttributeName": "Model Structural Representation",
            "Instances": [
              {
                "InstanceName": "",
                "AccessControl": "",
                "Identifier": "",
                "Description": "",
                "DefiningActivity": "",
                "InstanceAttributes": {
                  "StructuralRepresentationType": "",
                  "StructuralRepresentationClassification": "",
                  "StructuralAssumptions": "",
                  "StructuralLimitations": ""
                }
              }
            ]
          }
        ]
      },
      {
        "FeatureName": "Model Mathematical Representation",
        "FeatureAttributes": [
          {
            "FeatureAttributeName": "Mathematical Formulation",
            "Instances": [
              {
                "InstanceName": "",
                "AccessControl": "",
                "Identifier": "",
                "Description": "",
                "DefiningActivity": "",
                "InstanceAttributes": {
                  "MathematicalRepresentationType": "",